{
  "schemaVersion": 1,
  "revision": "sha256-54b1d2b461576a6b0383da3a2d1d9da8eec6c5c0f38f948958e888a2357a2247",
  "publishedAt": "2026-07-01T10:00:00.000Z",
  "environment": "production",
  "worker": {
    "artifactRevision": "build-abc123",
    "commandSchemaVersion": "1.0.0"
  },
  "release": {
    "actorArn": "arn:aws:sts::123456789012:assumed-role/go-automation-deployer/operator",
    "changeNote": "publish SEND API Gateway runbook"
  },
  "runbooks": [
    {
      "key": "send-apigw-analysis",
      "version": "1.0.0",
      "name": "SEND API Gateway analysis",
      "description": "Analyzes the SEND API Gateway alarm",
      "team": "GO",
      "kind": "APIGW",
      "categories": ["DELIVERY"],
      "tags": ["send"],
      "alarmNames": ["send-api-errors"],
      "definitionDigest": "sha256-aaaaaaaaaaaaaaaaaaaaaaaaaaaaaaaaaaaaaaaaaaaaaaaaaaaaaaaaaaaaaaaa"
    }
  ]
}
